id,text,rating,date,source
022f2d23-cc8b-44c1-82c1-3e60bb6458d7,"first time but I'm liking it so far because I can't never remember my password and you just happened to be one that I remember.I thought or some s***, and it didn't f*** with me.And my world is a good day , batteries , nothing",5,2026-06-26 05:43:54,Google Play Store
75b2ab2e-d784-48e2-ba56-706e03ec9265,I've been using the paid version of this app for many years. I love it! It definitely beats Sirius Radio in my car.,5,2026-06-26 05:41:03,Google Play Store
07478d05-c43e-4067-a0eb-ae75a77f7d67,"A great way to listen to music and podcasts, I heavily recommend it. My only issue is the amount of ads. I don't even need dinner when they shove 4 consecutive ads down my throat. They're really frequent and now there's even an ad for when you just open the app. Really awful, but overall Its a nice way to listen to your favourite songs.",3,2026-06-26 05:39:51,Google Play Store
70519fb7-313f-4adf-8422-4a488bdd5e91,"my only issue, when it says 30min of commercial free music and it's not even 10min of commercial free music.",4,2026-06-26 05:35:31,Google Play Store
ed6b7a76-8704-4260-aafe-ee7c1c955e24,overall very good if your mobile and like to play games with music,5,2026-06-26 05:34:12,Google Play Store
4f27b3a0-ade3-40fc-b46a-d111e9378097,you are too much. you're simply yhe best. I wish I have more words to describe your services. Thank you to the creators of Spotify 🙏🙏🙏💕💕💕,5,2026-06-26 05:34:09,Google Play Store
8f21d07b-1ced-4c69-ba22-28c1c504e5f9,Spotify is a trashy app despite it's large user count and I see no reason to keep using it,1,2026-06-26 05:15:55,Google Play Store
68269b28-8431-4cc2-8948-91cf7aa20f4b,I love this app,5,2026-06-26 05:05:51,Google Play Store
b2e75fd2-042a-49fb-a33b-ee3cbf0a4cd5,I just don't like ads,5,2026-06-26 05:04:18,Google Play Store
a7639594-2c42-4c2a-8bf0-e4ca9812b2d4,"Spotify is a staple in my life. Good deal also, the family plan is totally worth it.",5,2026-06-26 05:01:49,Google Play Store
4b31270a-9fc0-418b-a18e-fc31a26133d4,flexibility and boundless library,5,2026-06-26 05:01:23,Google Play Store
eeceb84c-340a-421f-a2f2-acf99964ce77,extremely happy,5,2026-06-26 04:55:23,Google Play Store
081651a0-fb1e-4f99-8f47-ddbb0f4aa25d,wonderful and easy to use.. really good to enjoy the music.its beyond what my expectation,5,2026-06-26 04:53:53,Google Play Store
0b8d4e5d-8055-406d-ad89-f8c9faec59c5,well mine Spotify is all ways stopping and I'm about to stop using this app. I'm starting to feel like I'm paying to much for nothing.,2,2026-06-26 04:51:41,Google Play Store
423c4c3b-d67d-4886-b5f9-7589b89c7fda,"Great app. Great music quality. Although, the app requires premium plan only, as the free plan consists of too many ads that you cannot skip.",3,2026-06-26 04:46:02,Google Play Store
728e9ba5-e33a-4750-b1ce-279e390666f6,tbh idk wts bcs ts th bst,5,2026-06-26 04:44:14,Google Play Store
4bfd4b55-674a-4461-9801-bf031dd0347a,"Spotify is the biggest music app I've ever known, they never disappoint.",5,2026-06-26 04:38:57,Google Play Store
b0fbb442-c007-4b37-ba26-bd0989d17491,"So many ads... Useless ads. The quality of the sound is not quite good but not bad, 50-50.",1,2026-06-26 04:34:50,Google Play Store
0fb7e72b-7e6b-4c27-b189-4bfd72ddf734,"Spotify would be a five star app if the options and decisions for free users were expanded. We can't even pick what we want to listen to from our playlists and we only have a couple skips an hour. I feel Spotify already was doing enough with this until they decided to take away queues for us as well. This is highly disappointing because now if you don't pay a subscription price of $15.99 a month, the app is practically useless. I don't mind the ads, but please at least give queues back.",1,2026-06-26 04:32:36,Google Play Store
8c41ce9e-990d-4a7a-bac1-53ce5c2466b9,"Loved Spotify on Apple devices for years but the Android version is slow, buggy, and takes up half my ram. The widget is hideouuuus",2,2026-06-26 04:30:41,Google Play Store
28f43404-d769-4aa8-a395-a2b9469f162f,"Redoing my review! so like I said, the app itself is amazing, the only problem id say i have is the ridiculous amount of ads",3,2026-06-26 04:30:15,Google Play Store
9fa205b9-7598-46e6-9f94-3888867e9330,keeps opening to a blank screen all the time when I want to use it. getting aggravating.,1,2026-06-26 04:27:59,Google Play Store
2869fa0e-0e71-43fd-b6f7-cfef24e78dbb,Too many ADS,3,2026-06-26 04:19:46,Google Play Store
c4b9453c-6ac7-4597-8401-75c514bafbbb,Let me hide locked bonus content. Some podcasts are so annoying to come back to after a while because I have to sift through an ocean of locked episodes to find where I left off. A filter option to hide them would go so far.,2,2026-06-26 04:19:34,Google Play Store
7cfbf933-6b87-4b79-a9c9-3a9604246dd1,"For the price I'm paying for this app, the amount of times I have to close and reopen it is unacceptable.",1,2026-06-26 04:17:27,Google Play Store
f3cd98b5-4d2e-4057-9f9c-163fdb1b6135,I can BARELY get through a song before Spotify interrupts!,1,2026-06-26 04:15:51,Google Play Store
00bf0325-45d9-4348-8877-b69bd4491de4,clear music,5,2026-06-26 04:15:18,Google Play Store
a8d65a1e-4e20-4c7e-b7b2-b6d70b6237b2,"strictly TV app review. The update removed Dark Mode so now my kids sit and stare at the TV, and that's a no for me big dog.",1,2026-06-26 04:10:05,Google Play Store
7637f756-9a5b-43f6-b8ad-eb9af5868224,amazing but plzz reduce the ads for free experience,5,2026-06-26 04:04:56,Google Play Store
a9b78a61-d296-47d0-bad4-f9fbb1f19d49,keeps crashing during songs,1,2026-06-26 04:03:58,Google Play Store
c3d80404-9fbb-4065-870c-9df9fc95bbfb,"keeps crashing to the point of being unusable, even after a reinstall edit: i have tried a clean reinstall as suggested. app appears to be at least usable for now, but it's extremely sluggish and unresponsive, making it frustrating to use",1,2026-06-26 04:00:58,Google Play Store
771d6aa6-125d-4b59-b411-280da53ac1f9,"very good and nice to hear the music 🎶😌 and tunes are awesome whahoó, thanks",4,2026-06-26 03:59:25,Google Play Store
ee1b6a7c-1107-46b2-aeb2-b237f165d8d1,great but don't like ads,5,2026-06-26 03:58:59,Google Play Store
19fc7667-1723-4bdb-942f-87abd7c48e47,"I like everything, but they just don't treat u right when u have a free account",3,2026-06-26 03:50:46,Google Play Store
b29c409f-69a4-4592-8f53-f60539e6df6d,love the amount of music great quality,5,2026-06-26 03:47:52,Google Play Store
5ff30814-dcc2-4ca9-8bc4-a5a57198e4d8,I love music.♥︎.,5,2026-06-26 03:47:16,Google Play Store
4e8183c4-a12b-4af6-918e-422829473724,"sudah 3 kali saya mengganti akun spotify tapi 3 kali juga saya mendapatkan bug, Spotify ku sudah 3 kali mendapatkan bug, bug seperti tidak bisa dibuka dan hanya muncul layar Abu-abu. TOLONG DI PERBAIKII!!!",1,2026-06-26 03:46:57,Google Play Store
923e22e8-ec91-4f5f-a624-b323f65b695a,Spotify is my go to app for music its a great app and I like the updates it gets,5,2026-06-26 03:40:08,Google Play Store
9652aa8a-14c5-4eb7-8ec0-867184d97f06,the dj never gets what I want! the A.I. dj is slow and off topic.,4,2026-06-26 03:38:59,Google Play Store
448cda92-2e6e-43cd-bd6b-6c9665446f7b,"Originally would be five stars, but now I get FIVE WHOLE ADS for every like.. Three songs, and why tf are most of them AI? It's literally disgusting. Please add a way to toggle off AI generated content such as ads and songs, it grates on my eardrums and triggers my Misophonia.",1,2026-06-26 03:38:50,Google Play Store
53ae5cff-3edb-486a-8d1a-b21d131ade52,love ❤️ my Spotify,5,2026-06-26 03:36:03,Google Play Store
a2334e17-79fd-4bbc-9eac-07bc7ba4d8bb,Very good 👍I love Spotify this app is amazing,5,2026-06-26 03:33:41,Google Play Store
270cc1a6-33cf-4cb6-9f10-1fd0bf5557bf,𝐼𝑡 𝑖𝑠 𝑠𝑜 𝑐𝑜𝑜𝑙,5,2026-06-26 03:32:52,Google Play Store
c2fa205b-6660-481d-850e-e38696615958,All Song free,5,2026-06-26 03:26:20,Google Play Store
cbc6326d-29a5-43cf-a150-243066097ff7,my experience has been the best esp on TV since there's no adds,5,2026-06-26 03:25:17,Google Play Store
dfceca15-d294-4f96-800b-383069897a46,"very good, almost got all the music that I like",5,2026-06-26 03:24:37,Google Play Store
48bb8515-629f-4e3b-9fa8-d723371f7f9a,more I can say again (100%),1,2026-06-26 03:20:45,Google Play Store
8a019fb9-e067-440d-ab5a-b1f5218734e7,absolutely good 💯,5,2026-06-26 03:18:32,Google Play Store
9dc6d7fd-edf4-45ac-b42e-3a5595da4a36,"Where are my musics in my playlist???? i cant play any music!!!!! is this a bug? what is this? i renstall it, and update it but nothing has changed!please check this problem",1,2026-06-26 03:18:11,Google Play Store
0bca7fab-20d3-4dbe-a51a-4d9a4bde2e2c,"Love everything about Spotify except that there seems to be a glitch that massively slows down and lags the app after I use it for over an hour. I just don't know what to do about this glitch, it interferes with interface and audio too.",2,2026-06-26 03:17:45,Google Play Store
f96e3bee-dc62-49bb-9650-3bdb9eb29b1d,"Please STOP recommending other artists' songs to me,I ONLY listen to BTS Thank you",4,2026-06-26 03:15:39,Google Play Store
3de4116c-a08f-49ea-9026-f933a2c763cc,I can play any of my songs,1,2026-06-26 03:14:53,Google Play Store
0beea563-d0f9-4a23-8f81-11b98f8b2080,good for music but has a little ads no problem,5,2026-06-26 03:13:57,Google Play Store
06ae49c8-66c4-4037-9d3e-c1b3b9780039,l love the amount of different music l can listen too,5,2026-06-26 03:12:13,Google Play Store
5e6cc41d-6cd1-43ed-a080-f5ec367bf5a2,On my new pH it glitches. (pH quality I believe.) However I love Spotify & wouldn't be without it.,5,2026-06-26 03:10:21,Google Play Store
14309f71-aaa6-4b8f-b486-52ede93d87be,"The app is very unstable at this point my question is this is the music listening app at this point?? As a premium user, I would say kindly remove the artist upcoming tours and it's following and all those videos in the player keep it simple like old days and make the lyrics option also a toggle to turn off or on the lyrics and plz optimize this app My device :- Xiaomi 12 pro (Snapdragon 8gen 1) mc app hao bsdk Paisa hi khate rho gai kya dallo optimize bhi kr lo app ko real addmi ko rkho bc",1,2026-06-26 03:04:38,Google Play Store
15088d9b-1e17-4cb0-99b7-e46f88b81676,very bad rules,1,2026-06-26 03:04:29,Google Play Store
48d06edd-f3e6-43cd-ba50-e8a72b721168,I don't really like it that much because I used to listen to my music on YouTube music but my friend recommended me to try Spotify because when u listen to music and you get of the Spotify app the music still play and I really thought that would be a grate idea but when I downloaded it and I got of the Spotify app the music stop rather than still playing,1,2026-06-26 03:03:06,Google Play Store
f843bbaa-fc2a-454f-a8c6-2099d7befd72,It's mind-boggling how many times I pause a podcast and hit play again it's never in the same spot. Whatever I'm listening to after playing after a pause it's reversed anywhere from two to 25 minutes. Garbage app.,1,2026-06-26 03:02:09,Google Play Store
b5785040-ad96-435c-89ef-1c1eee64b483,best app for song listen,5,2026-06-26 02:59:03,Google Play Store
f6f228ac-5a38-4b37-89f2-c16aaf087e5a,spectacular,5,2026-06-26 02:57:52,Google Play Store
4a16af93-ad59-4fc9-87c9-8f2a6d935466,I don't like the limited amount of songs and skips and the amount of ads is annoying but overall it's a great app,3,2026-06-26 02:51:56,Google Play Store
78e773f6-766c-4e02-82bb-a6f6510729a2,I just love it and it's so easy to use,4,2026-06-26 02:51:39,Google Play Store
0fa023db-253b-48a6-a020-28e04e4f6541,I love the app I can play games and music at the same time!,5,2026-06-26 02:44:52,Google Play Store
112f8614-fda1-415f-a7be-393519cbbe63,"everything u could need for music ,news and podcasts",5,2026-06-26 02:44:45,Google Play Store
ac891315-37c0-4ed0-83d0-ec30e6cebe58,"everything todo with music should be free, skips, replays etc",4,2026-06-26 02:44:39,Google Play Store
879e1d80-3e51-4bf0-a50b-1488f9a9e8b4,love it. does everything I need it to. and sharing songs with someone is easy.,5,2026-06-26 02:44:15,Google Play Store
bb1a9c7f-e34d-498c-8ab6-95e63c6894fb,"What's with the sudden app stops and occasional black screens... as of a recent release? Vibe coding perhaps? Yes, tried reinstall.",1,2026-06-26 02:43:45,Google Play Store
20e38a1d-6eb2-416d-807e-f383e1e6183e,This app has just about every generation of music,5,2026-06-26 02:43:17,Google Play Store
b64ebdf0-5dca-4638-9f88-a7d5c8597016,awesome variety,5,2026-06-26 02:42:35,Google Play Store
ca922905-8fe7-499e-9753-5c6f8df43537,Spotify free is bad because of countless limitations like no skips or you can't play what you want.,1,2026-06-26 02:37:28,Google Play Store
2a1cef5c-bdfe-4fa7-b34c-27d0ded8f797,random crashes now and then. the big issue is the shuffle line up. it arranges the same songs in the same order repetitively.,4,2026-06-26 02:36:32,Google Play Store
7cb945d7-1e23-44ca-b1c9-903aad12bb14,it looks good 👍 👌,4,2026-06-26 02:36:32,Google Play Store
76b24c3d-cd06-4fad-8ca9-7814c22a7466,"Getting more expensive for less content all the time. The only reason I subscribed to premium at all was because the ads are painfully loud, as in causing ringing in my ears loud, when using earbuds. Already an unethical way to gain subscribers. But you also get so little for what you pay, especially the audiobook situation. Cancelling my subscription and joining Bandcamp so I can actually own the music I pay for, and subscribing to Audible which is way cheaper for audiobooks.",2,2026-06-26 02:36:29,Google Play Store
21eea75c-8e43-4d88-ba85-8dfecaf1ee26,"Paying monthly for an app that struggles constantly struggles to load, struggles to recommend, can't play downloaded music without connecting to the internet. I've had nothing but awful experiences in Andriod Auto as well, takes ages to load of it even loads at all. It's shameful. Screw this app.",1,2026-06-26 02:33:35,Google Play Store
db87c127-01df-4eea-9f73-ea888acc8c22,why the hell do I need premium to actually listen to music? it's a music aap afther all!,1,2026-06-26 02:22:33,Google Play Store
dd5f30b9-3ef5-4906-a49b-be71a4bf03ba,"Well it is a great app although but I think there is still a lot of room for improvement. For example,not all the songs have their lyrics assigned it. But in a nutshell I'll say it is a great app but there is a lot of room for improvement.",4,2026-06-26 02:22:22,Google Play Store
29614d00-360e-4494-8d0b-f13e5fb2d6a0,good very good ap,5,2026-06-26 02:15:19,Google Play Store
27965830-f2e4-446a-be8a-4cbe1dcd4fca,"glich. not opening, blank screen",1,2026-06-26 02:15:14,Google Play Store
cf8cc9b9-9681-4aac-903c-385360b929f5,I love Spotify it's one of my favorite apps it provides so many genres and I can listen to every single song I want. It's really easy to use and you can jam all night plus they added a music video option which is really exciting. It doesn't have that many ads which Is rare and really adore this app,5,2026-06-26 02:14:08,Google Play Store
083bdf43-e457-4674-bf9a-214d7687249e,"It would be nice if I could listen to my list instead of having it keep going to songs it (thinks) I'd like. If I'm paying to listen to songs I want to listen to, why can't it stay on my list?",3,2026-06-26 02:00:12,Google Play Store
b9c43c13-d5ec-4eb3-8bd3-deb52e60421d,"Sort of works, 4/5 days it seems fine. Other days it wants to recommend the same 2 podcasts that I have no interest in and it won't let me remove them from recommended, or my taste profile (that I've searched for and can't find). The only thing I can do is leave a bad review to a podcast that is fine, just not for me. The rest of the day it does this play/pause thing that I have to remove the app just to play anything again, I've never shared my login. Has the music my kid wants to listen to.",2,2026-06-26 02:00:10,Google Play Store
728ce147-1b0e-40ab-93d3-f09ce2630066,it has all kinds of songs,5,2026-06-26 01:53:19,Google Play Store
92690dfd-c945-48eb-a206-1d253f76befd,it's nice. Hoping the Price doesn't go up.,5,2026-06-26 01:49:30,Google Play Store
72809429-3eaa-4aac-8574-bf476c7e5828,it's a great app with lots of good music but -1 star because there's a bit of an ad problem,4,2026-06-26 01:48:54,Google Play Store
2464217f-ac1e-4474-8829-1896f6e3fd2c,I use this app but I will never fully love an app that doesn't let you do the simple thing of copy pasting a title of a song since it doesn't want to let people leave the platform as if they're trying to make their app a tiny jail cell for music. ha. ha. do you like listening to foreign music? find a different app. I would have if I knew about this earlier. Good job dominating spotify! you get to do whatever while disregarding customers 🥰🥰 plus and I still can't copy haha what a joke,1,2026-06-26 01:45:10,Google Play Store
0608be60-5e76-4775-b1c6-befded5188da,it's good but I can't download music on this,4,2026-06-26 01:42:47,Google Play Store
ac0362b5-c559-4f2a-ae15-00f82a1e797d,seamless and fantastic,5,2026-06-26 01:40:49,Google Play Store
76dec062-3ad1-4f2d-883a-38c497a5ffc4,Way better then others I tried as far as free apps go. Sound Cloud kept playing music I did not like at all and there was no way to make it stop.,5,2026-06-26 01:36:31,Google Play Store
33974d79-1d57-4282-bb20-502dcd9c8e8e,Remove this app from PLAYSTORE DONT USE THIS APP INSTEAD CHOOSE YT MUSIC OR ANY OTHER.,1,2026-06-26 01:36:29,Google Play Store
00e7846e-bf7c-4b39-bb91-f0276d36ab8f,I dont like - this app beacouse of the data use,1,2026-06-26 01:36:00,Google Play Store
036fc65d-1562-4a74-872c-af15d69b2fc3,"worst worst worst, 4 adds ina row is much much moreee 🫩",1,2026-06-26 01:35:37,Google Play Store
3c09e5df-c73e-4cec-88a3-d4844ce73b4d,"Whenever I use this app in my car to play podcasts, instead of going to the next episode it always plays the previous one that I already listened to. Happens ever single time and is super annoying as I'm driving and don't want to have to fiddle with an app to make it play correctly.",3,2026-06-26 01:32:59,Google Play Store
98edfc6d-44e0-4843-83cf-9bb2fe51b160,"Updated the review based on a fixed resizable widget. Still delivers good choices of music, app in itself works most of the time. At times the widget just stops working or when playing via android auto, suddenly stops / crashes. AI is getting better and playing more of what I am requesting. Maybe would be nice to have an option of not seeing audiobooks / podcasts. Good that it doesnt use up much space for downloaded tunes.",3,2026-06-26 01:30:22,Google Play Store
ffc9bafa-7d2d-4151-a665-ee4c46ac5742,it's the best music platform,5,2026-06-26 01:29:49,Google Play Store
be8a9a18-6c4f-42a7-ae0c-3ab0dcd1566f,dope 10000%,5,2026-06-26 01:28:51,Google Play Store
7f0130b1-a49d-4c3e-916b-deb2c1327c5a,crashes after opening the song or que. I won't be renewing my membership tbf this has been the case for months. Why the hell can't you just fix the crashing issue?? it's been like 9 months bro. I've tried everything.,1,2026-06-26 01:26:21,Google Play Store
b3c137c2-d6be-4566-b240-de709ce3aaea,Fantastic !!!,5,2026-06-26 01:21:19,Google Play Store
93d0c504-3dac-456f-9a85-45bcea00389a,This is tooooo much now we can't even change the song by ourself...,2,2026-06-26 01:21:14,Google Play Store
b89f1d97-5b45-467f-bba2-6f5cded9baf4,To much ads,4,2026-06-26 01:19:35,Google Play Store
f2dfa1bc-b22e-489f-803e-9880b6f8a847,"The newest forced widget update is a poor replacement. Requires specific touch points to open the application, if nothing is loaded the widget fails to open the application. Dropped from 5 stars to 3. UI has become more touch-sensitive and swipes must be much more deliberate and near-perfect angle to execute the command.",3,2026-06-26 01:19:22,Google Play Store
1804c054-21df-45c2-b35b-ad84e64906e3,it's good ads are a little annoying but still good,4,2026-06-26 01:15:04,Google Play Store
caa1e921-f6c0-42a9-9958-635147eef2d6,Too bloated and slow. Even a menu option takes forever to show. Too many features have ruined this app.,3,2026-06-26 01:13:41,Google Play Store
83e21cc9-74da-4b47-bd72-9ab977790793,D out a rrd w E???_ - um ~,5,2026-06-26 01:13:15,Google Play Store
2be7831c-36c5-4386-afa5-896dab37f218,It's very quick on finding song,5,2026-06-26 01:07:16,Google Play Store
ca0c0de6-ef74-427b-ba5f-3aa13dde1307,I love it! thank you for your service god bless you 🙏,5,2026-06-26 01:07:05,Google Play Store
26bad411-7089-4a23-9d63-7b243ad81efc,it is the best platform to listen to music,5,2026-06-26 01:06:34,Google Play Store
ef35180b-7d81-49f7-a133-e55356d62f06,The new widget is trash. bring back the old one please.,1,2026-06-26 01:04:14,Google Play Store
f1d4bc27-1e41-46bc-bd15-b7522a4c72eb,Spotify has helped me to connect with my kids.,5,2026-06-26 00:59:53,Google Play Store
9b2285dc-614f-4388-8598-0559eed88639,I love my Spotify site. I am 74 and love to listen to music. Connie Davis.,5,2026-06-26 00:58:57,Google Play Store
9ab2afa0-c9fa-4a6b-9565-14c8e2e74f25,to many adds,1,2026-06-26 00:45:13,Google Play Store
65708953-616d-49e7-b451-828aa21015e1,stop making it hard to unlike songs and to remove podcasts this is so crazy why would you queue this up and I rated it one star let it go,1,2026-06-26 00:45:11,Google Play Store
6d83850b-8468-4a78-8479-69ec0b4dd82d,ads thats it,1,2026-06-26 00:43:09,Google Play Store
dfcfb75b-f924-4c20-97cd-1c2846fd1ac1,to many ads,1,2026-06-26 00:42:45,Google Play Store
b77f00eb-6a26-49ee-86ed-b7ea581c27b1,good app so wow,5,2026-06-26 00:38:22,Google Play Store
9c350c9a-1313-4592-bc75-6d9996a66054,Been awesome for me several years! 👍,5,2026-06-26 00:37:44,Google Play Store
a4001349-6d93-4a78-a196-37f2c0dfecff,"I am so angry and heartbroken! I had the settings on this app set to NOT put in 'Deep Sleep' if it went unused for a while, but it put it in Deep Sleep anyway. And in doing so, it deleted the voice recordings of my deceased sister, my husband who has terminal cancer, my twin sister who has advanced Alzheimers, and a few other recordings that I thought would be safe on this app. They are GONE from my tablet! Spotify, if this is in your control in any way, STOP DELETING ANYTHING FROM MY LIBRARY!",1,2026-06-26 00:36:00,Google Play Store
67bd1e84-623a-4e90-bc11-dcb31fd9dd92,I am very pleased with Spotify I currently have the free version so there is ads I am working on freeing up some money so I can get the paid version,5,2026-06-26 00:33:12,Google Play Store
ea43079a-1394-4747-8813-5c8e1d1f2003,too much ads,1,2026-06-26 00:30:46,Google Play Store
078af496-1ffb-463c-81a7-322baf283a74,it's great but recommends to many podcast on home screen,4,2026-06-26 00:28:29,Google Play Store
cd38785d-3e0d-4e5f-ad30-d9b7cf8f15f9,"Spotify has a great music collection, but the free version has become very frustrating. Getting 3–4 long unskippable ads after every 2 or 3 songs completely ruins the listening experience. The ads are too frequent and interrupt the flow of music. I understand ads are needed for a free service, but the current experience feels excessive and needs improvement.",2,2026-06-26 00:25:31,Google Play Store
b423d293-9cb3-440e-8649-63335fb62f1f,thanks liked it very much....,5,2026-06-26 00:24:27,Google Play Store
b6ee4015-9ca8-4acd-9227-324ef4a80e88,"I’ve used Spotify Premium for a year and decided to cancel. The main issue is the recommendations. I expected to discover new, niche music, but the algorithm got stuck in a loop, pushing the same popular tracks over and over. It fails outside the mainstream. ​Also, the audio quality is lagging behind. In 2026, Spotify still lacks lossless/FLAC audio. For decent headphones, the sound is just not good enough. Not worth the money.",1,2026-06-26 00:24:02,Google Play Store
5740ab5c-97c1-44f4-8989-1f783192ac24,"I have been using this app for just over a year. There always seems to be a delay after clicking on something. The past two days, the app crashed and couldn't recover in the middle of my classes. Seems like the price of subscription went up, while the technology went down.",3,2026-06-26 00:23:08,Google Play Store
d9417563-d9b4-4992-9de7-78464e82ece8,so expensive for premium 😕😔. Provide Spotify chart for Bangladesh 🇧🇩 or else I won't go for subscription.,1,2026-06-26 00:21:04,Google Play Store
225b05a9-762b-4527-9583-3eb918268109,bas ads thode kam karo,5,2026-06-26 00:16:29,Google Play Store
711c9894-e261-41a6-ae0e-d32d2f254897,but what I don't like in this app their advertisement is too much for me I don't like it but if is not because of the advertisement is the best for me,5,2026-06-26 00:13:03,Google Play Store
51bfd202-b8cb-4797-a2a0-9d420b2d3149,Vi 5G super 💯 congratulations 👏🎉,5,2026-06-26 00:10:36,Google Play Store
447a51bb-3dda-4ae3-9484-3b5f601c3c48,LISTEN TO MJ please,4,2026-06-26 00:10:34,Google Play Store
c66dc89b-3748-43fd-859c-56e4aee31b2e,literally slave like experience when you don't have premium,1,2026-06-26 00:08:22,Google Play Store
e92a7a12-6921-4de7-a054-26045dc17985,it's good but the ads are too much 😔💔,4,2026-06-26 00:08:03,Google Play Store
ee3db917-9065-480b-9b00-d5f1a63c0364,"Confusing and frustrating billing experience. I paid for my subscription on June 17, but was asked to pay again only 8 days later. My account had already reverted to the free version with ads, so it was unclear why I was being charged for a previous billing period and then billed again so soon. While customer support provided an explanation, the billing notifications were misleading and lacked transparency. Spotify should communicate billing issues more clearly to avoid confusing customers.",1,2026-06-26 00:06:20,Google Play Store
6073a4f3-b1e5-44e0-b20e-bbb87fdb1d86,the best app,5,2026-06-26 00:04:39,Google Play Store
bb23a155-a763-48ff-b916-78ca4f498151,great sounds,5,2026-06-26 00:03:48,Google Play Store
