id,text,rating,date,source
96bc875c-9788-420b-9085-abba8d111408,great app for music 🎶,4,2026-06-25 19:48:42,Google Play Store
b77afaeb-f609-44ff-9b14-7ebb60a425f5,best app for music lovers,5,2026-06-25 19:47:30,Google Play Store
d8cd11b4-4474-40c4-b687-8874982d7c0b,best music app,5,2026-06-25 19:44:56,Google Play Store
6ec4b6b0-def6-41c5-a407-0d9962826f40,it's my favorite music app to listen to song and worth using.,5,2026-06-25 19:42:33,Google Play Store
8f773880-2a6f-4733-a577-2c21afcb4e73,Useless App without Premium,1,2026-06-25 19:41:13,Google Play Store
7c93347f-7f50-4dfe-8876-9657596a437e,the app is very very good and I loved but lf you don't add in premium you can't download the album or listen to music's for internet I hate this please changed this one thanks,5,2026-06-25 19:39:07,Google Play Store
c557c717-8f7e-42a6-b6db-459484eefc8c,my is not working is showing me something went wrong,1,2026-06-25 19:38:31,Google Play Store
0c3fedc2-ccf1-4814-a996-3e0dff5eb8ce,Good app just let us play music on the watch speaker,5,2026-06-25 19:38:08,Google Play Store
17cad686-39bc-42d1-9754-fee6c670431c,most lovable app,4,2026-06-25 19:36:14,Google Play Store
7a0c964c-1939-4ff6-892e-b10076627f16,"since i started using Spotify I am enjoying this app,i can search an song I want it's good.",5,2026-06-25 19:35:26,Google Play Store
f69707ef-a1c9-4033-a363-82b561c972b7,it's really good,5,2026-06-25 19:28:16,Google Play Store
e3a43c70-cb9d-4900-935b-aad230337edd,i really love this app,5,2026-06-25 19:25:47,Google Play Store
37eae084-6cc7-4094-8ea8-f584ee0d8e0f,"I used enjoy the free version, but now the ads are seem more frequent or longer and why can't I close the silent ad you put over the artist playing without answering a question about my interest level??? looks like greedy bastard syndrome to me! p.s. I can tell you that I will never be interested in buying anything pushed on this app..ever",1,2026-06-25 19:23:30,Google Play Store
52199939-282b-4cc3-a036-42ee4d7b65cd,I'll choose spotify even in my next life. Very 👍,5,2026-06-25 19:23:19,Google Play Store
4cedfbf6-ad1e-4c5a-8d7b-1e71c6a9038e,love a system to listen my fav parts of song but sometimes after listening to some soñgs it stop to choose song for non premium membership people,4,2026-06-25 19:19:46,Google Play Store
60144d5b-ad65-4278-a15b-29d45b30815d,not sure yet not working,5,2026-06-25 19:17:24,Google Play Store
485d21c7-c6d8-4931-87d6-049b0bcc8b85,great music,5,2026-06-25 19:16:41,Google Play Store
ec3ae350-06ee-4f57-98f3-251c5b6eb729,it helped me find every single song,5,2026-06-25 19:16:14,Google Play Store
8c9dfb1c-1f81-4679-9f5f-6fac8fd9d742,good music tastes a like it,5,2026-06-25 19:15:03,Google Play Store
fba95a5a-1cc6-4369-a72f-e2879e46e122,good for just jamming out,3,2026-06-25 19:10:54,Google Play Store
950e398c-e27a-41f0-832f-7e50f7f1e90d,👍 good but they have increase the total songs listen a day,5,2026-06-25 19:10:35,Google Play Store
fd6ec79b-f28c-473c-8675-d18568d64dde,it is very good app but jst have too many ads.. but otherwise it is a very good app🌸🌹,5,2026-06-25 19:06:44,Google Play Store
9e45770b-ba42-4ea0-8711-90bd541efa6c,I am enjoying the app. It keeps me closer to my inner mind through music 🎶,5,2026-06-25 19:05:32,Google Play Store
5d3bc8c4-9155-436a-b1df-785815e622b4,Love all the music,5,2026-06-25 19:04:26,Google Play Store
5258808d-31b8-429a-9b4a-d93c0e6e474e,such disgusting app I played song first ad will appear we can't play in order that we want. lot's of ad always pop ups this is so irritating I'll prefer listen songs on YouTube,1,2026-06-25 19:00:39,Google Play Store
59b5a46f-6c49-4b5a-9a6b-4d7c2caf48e8,"I enjoy listening to music on Spotify, and I honestly don't mind the ads that come with the free version. What frustrates me is that the app keeps going black or suddenly stops working for no reason. I've lost count of how many times I've had to uninstall and reinstall the app just to get it working again, only for the same problem to come back later. It's becoming really annoying because I just want to listen to my music without constantly troubleshooting. Fix this issue please 🥺",2,2026-06-25 19:00:35,Google Play Store
757a9cbc-38a4-42ea-a45f-28b32bb9fe25,best app ever 👍😁👍😁,5,2026-06-25 18:58:46,Google Play Store
38257cb0-be78-4784-a56b-04ffdb1d44d0,"absolutely love Spotify! The app is easy to use, has a huge collection of songs, and helps me discover new music every day. The sound quality is excellent, and I can create playlists for every mood. Spotify makes listening to music fun and enjoyable wherever I go. Highly recommended to anyone who loves music!",5,2026-06-25 18:58:31,Google Play Store
20be9c8b-8e16-4930-bbb2-452f1e820d08,I love this music,5,2026-06-25 18:57:42,Google Play Store
5aaa2102-4259-4b9d-b923-78d64676ecaf,"imagine, buying a plan that cost 3$ but can even using the apps because the apps network so fcknngg trashh",1,2026-06-25 18:51:23,Google Play Store
eb85b45d-d7b4-488a-9acf-8aa1f7d23c1e,Trash. Use youtube or soundcloud instead.,1,2026-06-25 18:49:59,Google Play Store
8a100925-4695-4c33-b555-1c161bf5be24,"give us basic human rights to let us pick what we listen to without any limit. it's getting absurd and greedy, nobody likes it. it's time y'all finally listen to us to make our experience better for god's sake",1,2026-06-25 18:49:19,Google Play Store
6e28a9e6-8a09-4cdb-852f-6ace03da11a3,this app is very nice 🙂,4,2026-06-25 18:48:34,Google Play Store
9a430256-a0d5-4e3c-95d6-ab7b29786a11,"It's a Great Music app, We already know that",5,2026-06-25 18:47:03,Google Play Store
162e28ce-a022-47e2-881e-8c42833c6552,nice app perfect for good music listeners,5,2026-06-25 18:45:39,Google Play Store
3d8ee27f-e808-4b7e-bd64-38dcb247c15e,no need rate 😀 you need just money for everything even to skip the song's,1,2026-06-25 18:45:01,Google Play Store
b2883631-fca8-45dd-b64d-70ed0a67f68b,You cannot remove podcasts from your library if you listened for a while and you do not like it. You still get recommended it and autoplayed after other podcasts. How can I set that I do not like it and I do not want to hear it. I listen podcasts in car and it is not easy to change it once it got autoplayed. Not good app for podcasts. I am moving to different app. Very bad experience.,2,2026-06-25 18:44:42,Google Play Store
287f37db-e3b0-4b3c-ba07-42ce3f277dab,App is unresponsive with frequent freezes and crashes. Unreliability makes it frustrating to use what is meant to be a paid service.,2,2026-06-25 18:43:42,Google Play Store
261279a9-bb93-46ac-aaec-dd5a41df042a,I've been using this app for years. I wish we could turn off smart shuffle when we don't have premium. smart shuffle is the most annoying thing in this app ps. free version is really terrible,4,2026-06-25 18:42:06,Google Play Store
d1a568a9-a733-4cb1-9027-97282927e37e,“Spotify is a great app for listening to music and podcasts. It has a huge library and makes discovering new songs very easy.,5,2026-06-25 18:34:24,Google Play Store
09efc90e-58b1-44c7-8b9a-658b9a6b5129,premium was expensive,3,2026-06-25 18:33:45,Google Play Store
9b08212c-a1dd-4ae4-8d9b-d9f873eac671,super distressing,5,2026-06-25 18:29:51,Google Play Store
a427c641-7c61-4029-9438-0383f9d41b46,Everything requires a premium ...,2,2026-06-25 18:28:24,Google Play Store
639c1de5-c482-465a-8eaa-0f571c272fe6,W spotify (hasn't given me any problems at all),5,2026-06-25 18:17:21,Google Play Store
19cc4c32-4f56-42f7-a0fc-8a39c92c617a,it just toooooo goooood bro,5,2026-06-25 18:10:11,Google Play Store
334d2816-ab4b-4065-8cbf-8e19957610f6,100/100 service,5,2026-06-25 18:09:09,Google Play Store
23381393-0e72-4f2d-83b3-15bc3401fa00,since the update no sound will come only TV while using app at home,1,2026-06-25 18:07:32,Google Play Store
17db469e-d80f-4514-a657-56575ddb6ccd,"not working after this last update, I'll just watch youtube.",1,2026-06-25 18:04:13,Google Play Store
6700fb29-b45a-4745-b9c7-cad52f0b436f,Lots of ads but worth it. Best music app 1 month is ad free (u get premium for 1 month).,5,2026-06-25 17:58:54,Google Play Store
87648272-cc6a-4edc-b28c-8aeb056f6dfb,i like this app,4,2026-06-25 17:58:48,Google Play Store
4706c16a-2f00-42d3-bd5a-48ec3a6486fc,"Don't know what has happened to Spotify. Music is breaking, every song on any device has mute moments. The new widget sucks and not allowed to use the previous one - have to open the app through apps since widget is useless and showing offline most of the time. And all this 'quality stuff' happening in paid version, woop woop!",2,2026-06-25 17:58:23,Google Play Store
66170c12-afab-440e-be6f-368c167743d0,Spotify is giving me a reasons to switch in other apps this app is not for songs.it is for ads we need to listen one song and then listen 4 ads. so now switch on other apps. this app is reduclise and garbage 😡😡,1,2026-06-25 17:57:17,Google Play Store
f1107b63-2867-453d-89be-ebb19d86bb28,too much ads,1,2026-06-25 17:56:28,Google Play Store
29e2ca3c-723a-4d04-b527-3a856a114ac0,تجربة سيئة جدا وإعلانات بشكل مستفز حتى مش إعلانات تجارية هي إعلانات لتدمير التجربة فقط,1,2026-06-25 17:56:00,Google Play Store
66c2a666-5a19-4f3c-b316-aaa1ae674866,bring back sort button on android UI,1,2026-06-25 17:54:10,Google Play Store
e8b9b2a5-3e14-4907-b445-a30b0449a5fc,"I don't really like what spotify has been doing, i mean for the people that don't have premium it's just sad, if you know. (probably) And theres not such another app close to spotify. Atleast not that i can find because i don't really support spotify anymore. Everything is in so much overpay for this and that these days?",1,2026-06-25 17:50:42,Google Play Store
21079e72-5036-4abe-b390-ffb83a74b6b1,"I selected Tamil as my preferred language, but every time I open the app, it shows content from all languages instead of remembering my preference. Whenever I want to listen to Tamil songs, I have to manually select Tamil again, which is very irritating.",1,2026-06-25 17:49:29,Google Play Store
c45b694b-c357-42a4-aece-d6acea48497a,Best of it kind,5,2026-06-25 17:46:03,Google Play Store
81387d85-5785-4e00-bca9-badba025c1dd,nice but now a days more adds,3,2026-06-25 17:43:36,Google Play Store
f5a9513e-58d8-4ea9-af67-b046ce20953e,10 + years of enjoyment. Glitchy sometimes,4,2026-06-25 17:41:17,Google Play Store
97c1f044-1a32-4da7-9817-3243b31ca4e8,exceptional,5,2026-06-25 17:40:44,Google Play Store
7fc335b2-af2c-4470-9eec-7a558179fc9f,I pay $20 a month and I still get hounded with ads.,1,2026-06-25 17:39:28,Google Play Store
e4ae071b-7e42-4b02-89ac-d43657e73e74,just greatest thing that could be available,5,2026-06-25 17:37:53,Google Play Store
9ae3a43b-17d8-4ca9-8b17-e352a3cfa916,so many ad every one or two song so annoying that i started to think of undeleting this app,1,2026-06-25 17:36:22,Google Play Store
c0f97200-29e7-4014-a5e5-07c111d00d54,"bug,Soo bug.please I just want to hear music!!!",1,2026-06-25 17:35:02,Google Play Store
447333d5-ef36-478d-b219-8feda172cbb1,"you are greedy, start putting customers to thought! spotify has too many ads. from quick and constant, to long AND constant. i used to get only 2 ads, hell sometimes 3, but now i get 4+ ! it's rather often im not able to choose/skip songs! what kind of music app cant let users pick their wanted songs? for the cherry on the top, spotify keeps crashing. in an average, my spotify crashes every 5-8 TIMES PER-DAY. feel my pain!! stop being so money hungry!",1,2026-06-25 17:34:30,Google Play Store
1d91a85d-8137-4961-9be3-0d88bfc12532,very nice.superb.need some help to activate premium,5,2026-06-25 17:34:24,Google Play Store
79e8832f-55e5-4c44-999b-8028599b0567,it's soooo gud I hope people know hw it works,5,2026-06-25 17:27:01,Google Play Store
90c12d92-e1a5-4211-95ad-88322e4337c4,just having my downloaded pod episodes all disappear for no reason. having this app not play something I downloaded without a wi-fi connection... all kinds of reasons to hate it.,2,2026-06-25 17:25:12,Google Play Store
fbeccdd2-f06e-4626-afac-14b5394adb21,best music app I used and that says something lol,5,2026-06-25 17:25:03,Google Play Store
a5cdb147-c198-41b0-94bd-598640a32681,just make it free bro,4,2026-06-25 17:24:37,Google Play Store
09badd58-4ff1-4a88-9431-0ed9abecd6cf,i downloaded songs all of a sudden it disappeared,5,2026-06-25 17:23:45,Google Play Store
5e0227c8-621f-47b5-abaa-837206822a60,Turns out you have to be over sixteen TO LISTEN TO MUSIC!?!? Overall the app is great and easy to use,4,2026-06-25 17:21:45,Google Play Store
84c8e4f9-3535-4c8b-9b05-1bf50822254a,The new widget is broken. please fix it,1,2026-06-25 17:21:05,Google Play Store
141ade7c-883d-4fc1-9ea1-5fc403aa947f,Huge library of music with great recommendations. The app runs smoothly and makes finding new songs enjoyable.,5,2026-06-25 17:20:47,Google Play Store
68685ebb-163a-40f8-8517-98d49b4e7e01,the app is amazing I loved this most for songs . l just live so much this app for music . recommended for songs lovers.,5,2026-06-25 17:20:35,Google Play Store
65f8ff50-a5fe-4998-bbcf-d65e78f7bb4a,great app with amazing built in features that make it easier to listen to a vast amount of artists as well as personal taste with a great platform for giving young emerging talent to shine,5,2026-06-25 17:20:13,Google Play Store
a4a76b8c-b776-4d47-81fb-0c8dad97210b,kebanyakan butuh premium anyinh,1,2026-06-25 17:16:24,Google Play Store
e16998e1-0d46-4782-a9ad-25fc01f340df,I love music and Spotify,5,2026-06-25 17:15:03,Google Play Store
e6e936c0-b555-4d49-8695-fe7523e2c3f2,very good app this app amezing 💙❤️❤️❤️😀,4,2026-06-25 17:13:49,Google Play Store
4ee5abb4-bc04-4ff5-b71e-846f78d1398f,Best App ever what were i without this App🫰🏽,5,2026-06-25 17:11:42,Google Play Store
fe5849bf-ff2a-4036-bd05-80baec119a30,is me gana bohot aaccha aata haii,5,2026-06-25 17:10:28,Google Play Store
cfb3100e-81d7-4d2a-b3ae-d791f4c83d9a,🐦‍🔥 Chrisally Rosé Crux no,5,2026-06-25 17:08:54,Google Play Store
dcd2c872-7017-4d92-bfbd-c82faf5beff5,I love the app but recently it keeps stopping and restarting the app. My phone then told me you guys need to fix some bug and update it before I can use it again. Edit: Thank you for fixing the bug!! It works perfectly now without kicking me off or restarting the app.,5,2026-06-25 17:05:15,Google Play Store
d4627742-6655-427c-b9f1-c3c711471224,why all songs are in primium,1,2026-06-25 17:03:39,Google Play Store
d1282352-b896-4d24-8719-dbc45746946d,Best Music Apps,4,2026-06-25 17:01:54,Google Play Store
576ccd92-2316-4f65-926e-9f31b421df15,know what i like. go to SpaceboyGT SpaceHypeNetwork,5,2026-06-25 17:00:58,Google Play Store
7f0de4d9-300b-4e11-903e-e9a009a00f0e,✨✨✨magical✨✨✨✨,5,2026-06-25 16:59:48,Google Play Store
8aab04e5-7563-4339-bc5e-b674a324751a,Spotify is a very good app for listening music. It offers vast variety of music and podcasts but the only thing is that without premium it is very irritating u get ads after almost every song and those too long ones so if the ad rate could be improved this is 5 start i liked the older Spotify where after a add break u get 30 mins of uninterrupted music without ads but now on the newer version I can't say.....,4,2026-06-25 16:59:22,Google Play Store
0aff698c-050f-4762-89e3-fb7a2bc81cd6,"best app, to be honest,",5,2026-06-25 16:55:39,Google Play Store
6b07d199-56b9-48a2-a898-1b9e97f29705,very nice app for Android,5,2026-06-25 16:52:20,Google Play Store
ad204668-25c7-4ab3-a3ce-18c7955ec702,ad coming very fast,5,2026-06-25 16:50:20,Google Play Store
36f736a4-d06b-40c1-a16f-805058ab6b79,hamesha premium mangte rehta bilkul achha ni laga bohot jada dissatisfied feel hua very bad app isko sudharo bad,1,2026-06-25 16:48:39,Google Play Store
c91659b2-3d24-4616-9379-c2b0c622c207,An almost infinite jukebox for very little cost. What's not to like ?,5,2026-06-25 16:46:51,Google Play Store
b6ac1761-56d3-4217-ab54-20ed7748d93c,so many peak song,5,2026-06-25 16:45:38,Google Play Store
0d35d11f-3304-474c-95b8-cf034bce1ca1,"it's really nice, though sme songs reach an extent and are no longer available. also increase on the mix capacity to make it sound more like a the dj is the one in the mix..",5,2026-06-25 16:45:04,Google Play Store
7516cc44-7971-4aa1-a45f-0c86cb2c48e6,excellent performance of the application,5,2026-06-25 16:44:55,Google Play Store
7f770361-0691-42c3-885b-63a9708dd2ed,I listen to podcasts all the time. Super useful.,5,2026-06-25 16:43:09,Google Play Store
538a7def-e7fa-4e12-876f-9f58e5d216b0,Im really happy Zara Larsson is on here!!,5,2026-06-25 16:38:35,Google Play Store
0eb95dac-2620-450e-8d3a-5a4ac6cf1832,Lovely and fulfilling to use.,5,2026-06-25 16:35:02,Google Play Store
32bdc975-36f7-49f7-9eb3-ca95d33cd29c,Just a suggestion. Add an AI that ca find similar songs and artists and albums. -✅,5,2026-06-25 16:33:33,Google Play Store
6daaf548-9f2a-4082-8eb3-8441fe72425f,very good range of music,5,2026-06-25 16:31:12,Google Play Store
124b9781-dd25-47e7-858d-ac7375ecf94c,very app for listening songs and podcasts but after subscription,4,2026-06-25 16:26:51,Google Play Store
f1ab7eb8-10e9-44b2-bb66-7ae9143559c6,this app is very nice,5,2026-06-25 16:26:39,Google Play Store
dbbdffb2-d55b-4a2e-a8c2-fe7d48aa53b0,its great 👍 I love it 😀,5,2026-06-25 16:21:48,Google Play Store
12191de9-0cb1-42b0-9a7b-c4fd4dc5a44b,all is good man i like it,4,2026-06-25 16:21:39,Google Play Store
7d1eba6e-454f-46fe-a04a-9fbc27611995,it's just pay 2 win,1,2026-06-25 16:20:12,Google Play Store
b879836f-792e-46d9-9011-98242a759add,"Used to be one of the best apps to use for music, Spotify if you guys are reading this you guys have really ruined spotify with the premium things, spotify you guys really screwed up. you can't even play a song of your choice, can't skip songs, can't go backward or forward, then what's the point of using the app? they'll play us random songs out of our interest and give us only the options to play/pause, why give us that take that away too, infact why even have it free make the app paid, useless",1,2026-06-25 16:19:25,Google Play Store
dfaa4baf-220d-441b-8ef8-f4ebf83e725f,ℙ𝕒𝕣𝕥 𝕒𝕝𝕝 𝕕𝕒𝕪,5,2026-06-25 16:15:50,Google Play Store
ea9dca5c-c1f3-4476-8a95-14f27b934c7e,it's the best app that don't use too much data,5,2026-06-25 16:14:06,Google Play Store
4085c452-0fa2-4d19-b0aa-19bbdef5001c,it's really good,5,2026-06-25 16:10:24,Google Play Store
c356e865-b850-42f6-8c96-73354c324fec,Best music search.,5,2026-06-25 16:08:50,Google Play Store
4bf0fe91-9503-4fe6-aa94-4536a1f029a2,Exceptional functional,5,2026-06-25 16:04:36,Google Play Store
d8039164-4d18-4cc3-916a-eab2e94caace,the ads everywhere.. youtube is lot better than this without premium,1,2026-06-25 16:01:30,Google Play Store
e8da241b-a499-4b46-a9f4-15f0b3653f82,Aplikasi sengaja menyusahkan cara mencancel membership premium,1,2026-06-25 16:00:18,Google Play Store
31929eab-b88a-458f-ad6b-709848231537,worst app I have ever seen not even a women of it's words without premium u are pathetic......just like Homelander without his powers.......even Indian Media don't lick the foot of politicians as much as you obey the advertisements......most annoying app ever seen on this Earth........you ruin my mood everytime I ask for your help if this box had infinite word space even that would not be enough to describe your cons,2,2026-06-25 15:59:18,Google Play Store
d80c97cd-6d7f-4c10-857a-19b837c5ff4c,"BOHUNCHOD STOTIFY LAORA , ADS KA DUKAN HAI YE LAORA APP. RUNDI SPOTIFY",1,2026-06-25 15:58:14,Google Play Store
6c75624e-40ff-4b09-b089-2408cbf80dd6,yeah it is good 💯,5,2026-06-25 15:55:29,Google Play Store
aab1b3e3-39b3-40f4-a44a-8686a1d16735,For me only Spotify music apps 🤩 its totally different from others apps.,5,2026-06-25 15:52:39,Google Play Store
c9084eba-897e-415e-8425-b207de6a8cb8,why sportifuy JAM option not working,2,2026-06-25 15:52:17,Google Play Store
c6f0f819-620b-4655-895e-91c9718650e2,"Highly Entertaining, and Smooth",5,2026-06-25 15:48:50,Google Play Store
9851b0f1-b005-4ba9-8fd6-44ea7355c49f,what should I say like this app deserves every beautiful word that exist in this world 🤌🏻🎀💗,5,2026-06-25 15:42:42,Google Play Store
2b54e18e-48ff-4fe7-8b32-8dc5ed620668,"buggy mess with horrendous ui, extremely expensive subscription whilst not paying artist nearly enough for their music.",1,2026-06-25 15:40:53,Google Play Store
65e49768-c38e-43c3-b275-7b934bfb413c,only for subscribing,2,2026-06-25 15:39:36,Google Play Store
21c2641a-1098-4347-ad0c-1ff8167c1876,it's just a well made music streaming app,5,2026-06-25 15:37:25,Google Play Store
f96f5511-05ae-4857-a971-6ba89b695c98,it's so good good platform,5,2026-06-25 15:36:56,Google Play Store
06ae1a04-716b-4559-ab06-895f8b1741f2,Just make it pay to use. I can't even play my own song without subscribing to premium. I am switching to another music app. If I can't find one who cares. Let it die.,1,2026-06-25 15:36:50,Google Play Store
acae4be7-d60b-41cf-9a4f-e2d4db9df778,"it's very useful and budget friendly!I would highly recommend this app,aside from not being lag like other apps,this is a very efficient and my go to when I like to listen to music!",5,2026-06-25 15:32:12,Google Play Store
8d427bea-2ff5-47c5-a4cd-3a9ba1c2c4d8,gooooooodddd,5,2026-06-25 15:31:31,Google Play Store
b796a8d1-de67-4d92-be25-e852e255260b,I love the app n everything it does like saving all my music but the thing i dont like is that it randomly freezes or stops working in general. PLEASE FIX.,5,2026-06-25 15:31:17,Google Play Store
3f2974ff-73ef-4734-92c6-f07ddb32ded8,to sad because of the I want to download my songs again but because of the premiun I can't😔😔😔,1,2026-06-25 15:30:09,Google Play Store
25233d8e-2277-4e29-9e18-80c9deed188b,best app in song,5,2026-06-25 15:24:16,Google Play Store
b0b80758-f6da-406a-b516-0157cf05dfe5,i just love itt,5,2026-06-25 15:23:18,Google Play Store
1ccb7fbb-d295-4cb4-8c77-55b220aa313a,tooo many ads,1,2026-06-25 15:22:57,Google Play Store
ab2a09e4-7296-49e5-9ca5-ca451c2196c4,The best app everrr❤️,5,2026-06-25 15:21:24,Google Play Store
9d134085-865e-4cee-9ca0-f1f3cdb2f651,if you don't want to buy the premium then this is the worst app like first of all the adds and it's okay I'll tolerate them anyway and then they don't even play te songs that I've added in mg playlist they play the songs that aren't even on my playlist,2,2026-06-25 15:18:53,Google Play Store
e6f7b2c5-7a65-4d38-af96-b2bb80decd67,after some play music we don't change song,1,2026-06-25 15:17:42,Google Play Store
2fa5b422-b72d-4b7e-94fd-025db5633c0c,love that is play most tracks,5,2026-06-25 15:09:38,Google Play Store
9b118e6b-036b-4f0a-8928-e9c88e8bf09b,are yaar yah to bahut badhiya hai,5,2026-06-25 15:06:12,Google Play Store
cb1ed5b2-2fe6-4fbe-b1e3-12f69bf8f571,"i bought the premium but my spotify keep offline and can't open it for a while ,please fix the bug you freak",1,2026-06-25 15:04:03,Google Play Store
6f78fa04-77c4-4ea0-a293-5408b5783e43,mein jab music laga ke doosra app open karta hoon ya nhi karta to thodi der baad music band ho jaata hai par music quality aur musics ke liye mein ⭐⭐⭐⭐⭐ de rha hoon,5,2026-06-25 15:02:06,Google Play Store
1d529a31-0574-44aa-b89a-baf1c7f4e668,so good at music.......🩷🍓🫠💅🏻🤌🏻,5,2026-06-25 15:02:05,Google Play Store
e1c0767e-f382-49c6-b256-cd5e8ed45f2e,very good experience,5,2026-06-25 14:58:24,Google Play Store
4bb8f5cf-dc36-46b1-bbfc-e5eb9d829208,dude why do you have to pay real money just to listen to music you want at any time,3,2026-06-25 14:55:04,Google Play Store
0cc77fd9-72ff-48ea-a1f9-5858bdecad9f,It's okay. the bugs are getting annoying but it's still kinda usable,3,2026-06-25 14:50:57,Google Play Store
9956d8cd-48c9-4196-9fa8-34edfec930ab,"A great app for listening to all the music you like, alone or with friends.",5,2026-06-25 14:48:21,Google Play Store
7d1e1aab-4d6f-4aee-9ab2-36dacaa71941,so nice 💯 app to listen music,5,2026-06-25 14:47:09,Google Play Store
9b577bf1-0667-46a9-a0f6-61ab7e2bc63a,"All I need from a widget is 3 buttons: rewind, play and forward. 4 by 1 was large, what made you think that 4 by 2 is a good idea???? plus I can't even use 4 by 1 now: shows a message ""try our new widget"". really?? what the fluff?? please stop making large widgets and return at least 4 by 1!!! thank you",1,2026-06-25 14:45:08,Google Play Store
dd25de6a-d72a-42f6-8257-ea7be5e67704,EVERY single time I want to use this app I have to uninstall and reinstall in order to be able to open the damn thing. Once upon a time this never happened. Fix my favorite app please.,1,2026-06-25 14:43:56,Google Play Store
978255b2-06f1-4120-8ea4-c4251e0d820d,very very bad 😡😡😡,1,2026-06-25 14:42:58,Google Play Store
b8468dde-ab57-4423-8f88-4cd9502a0753,"The new widget you are actively trying to push is buggy to high heavens. Was any tests done at all? I just want to restart a song by pressing the previous button once, before I know it I'm at another song entirely, and half the time it doesn't even load, just blank white screen.",1,2026-06-25 14:41:43,Google Play Store
55b5565d-e23b-49a5-a62a-08b2bd78c53c,it is an best app where we can listen songs,5,2026-06-25 14:39:11,Google Play Store
7654568a-305b-4cb4-a10b-73c0d538529c,best music app,5,2026-06-25 14:36:54,Google Play Store
6ceeafe0-eca7-47a7-ad45-686a8416e299,can we have comments section for each songs,5,2026-06-25 14:33:15,Google Play Store
1ae22b80-59d2-43a6-8f7f-ce4e03916f3f,best ever app for listening music,5,2026-06-25 14:31:24,Google Play Store
cfe06ec3-4aad-46df-9827-c612724d2774,The app is very easy to use its gud😀,5,2026-06-25 14:31:11,Google Play Store
d4a91d47-2040-41bd-9c90-ec584ebb34da,disturb the adds,1,2026-06-25 14:31:08,Google Play Store
